2,729,25982,Canaveral Council of Technical Societies,Nonreimbursable Space Act Agreement with CCTS for theCollaboration on the Annual Space Congress Event,6/14/2017,6/14/2022,Non-Reimbursable,"$162,020",KSC,KCA-4526
3,730,25967,"RUAG Space USA, Inc","Reimbursable Umbrella SAA with RUAG SPACE USA, INC forNASA Testing Services",9/21/2017,9/21/2022,Reimbursable,-----,KSC,KCA-4544
4,731,25544,University of Puerto Rico,Nonreimbursable Agreement between NASA and Univ PuertoRico for NASA Educator Resource Center,7/13/2017,7/13/2022,Non-Reimbursable,"$19,888",KSC,KCA-4529 Rev Basic
0,733,24609,SEMINOLE COUNTY PUBLIC SCHOOLS,"KCA-4517, Nonreimbursable SAA between NASA KSC and theSchool Board of Seminole County, FL for High School StudentsUnited with NASA to Create Hardware (HUNCH) ProgramParticipation",10/19/2017,10/19/2022,Non-Reimbursable,"$277,277",KSC,KCA-4517
1,734,24427,FLORIDA INSTITUTE OF TECHNOLOGY,"Annex 3 to Nonreimbursable SAA with Florida Institute ofTechnology (FIT) for Collaborative Research, TechnologyTransfer, Education and Outreach Activities",2/15/2017,6/29/2021,Non-Reimbursable,"$106,645",KSC,KCA-4471-3
2,735,24385,"Blue Origin, LLC","Fully Reimbursable SAA between Blue Origin, LLC and NASAfor Use of Center Capabilities",3/27/2017,3/27/2022,Reimbursable,-----,KSC,KCA-4514
3,736,24320,Brevard County Public Schools,Nonreimbursable SAA between NASA and High SchoolStudents United to Create Hardware (HUNCH) ProrgramParticipation (Brevard County),4/21/2017,4/21/2022,Non-Reimbursable,"$539,103",KSC,KCA-4518
4,737,24296,"UNITED LAUNCH ALLIANCE, LLC","Fully Reimbursable SAA between United Launch Alliance, LLCand NASA for Use of Center Capabilities",9/28/2016,9/28/2021,Reimbursable,-----,KSC,KCA-4504 Rev Basic
0,739,24145,"AECOM Management Services, Inc","Fully Reimbursable Umbrella SAA between NASA KSC andAECOM Management Services, Inc for C3PW",9/8/2016,9/30/2020,Reimbursable,-----,KSC,KCA-4495 Rev Basic
1,740,23983,Blue Origin,Nonreimbursable SAA between NASA and Blue Origin forCommercial Space Capabilities Collabortion,4/15/2016,4/15/2021,Non-Reimbursable,"$183,072",KSC,KCA-4502 Rev. Basic
2,741,23737,University of the Virgin Islands St. Thomas,Nonreimbursable SAA between University of the VI St. Thomasand NASA for Regional Educator Resource Center,4/19/2017,4/19/2022,Non-Reimbursable,"$45,844",KSC,KCA-4498
3,742,23035,"Integrated Mission Support Services, LLC","Annex 11 to Fully Reimbursable Umbrella SAA between NASAand Integrated Mission Support Services, LLC for C3PW",5/3/2016,9/30/2020,Reimbursable,-----,KSC,KCA-4464-11
4,743,23034,"Integrated Mission Support Services, LLC","Annex 10 to Fully Reimbursable Umbrella SAA between NASAand Integrated Mission Support Services, LLC for C3PW",5/3/2016,9/30/2020,Reimbursable,-----,KSC,KCA-4464-10
0,745,22478,MUSEUM OF AVIATION FOUNDATION,Nonreimbursable SAA between Museum of Aviation and NASAKSC for NASA Regional Educator Resource Center (RERC),5/2/2016,5/2/2021,Non-Reimbursable,"$36,801",KSC,KCA-4477
1,746,22377,"UNITED LAUNCH ALLIANCE, LLC","Annex No. 1 to Nonreimbursable SAA Umbrella Agreementbetween NASA and ULA, LLC for Demonstration of Cryogenicand Secondary Technologies for Launch Vehicles",1/21/2016,1/21/2021,Non-Reimbursable,"$2,161,402",KSC,KCA-4461-1 Rev Basic
2,747,22376,"UNITED LAUNCH ALLIANCE, LLC","Nonreimbursable SAA Umbrella Agreement between NASAand ULA, LLC for Demonstration of Cryogenic and SecondaryTechnologies for Launch Vehicles",1/21/2016,1/21/2021,Non-Reimbursable,$0,KSC,KCA-4461 Rev Basic
3,748,22325,American Honda Motor Co.,Reimbursable SAA Umbrella Agreement between NASA andHonda Optimization of Smart Technology Systems,3/23/2016,3/23/2021,Reimbursable,-----,KSC,KCA-4473
4,749,22324,"Intergrated Mission Support Services, LLC","Annex 8 to Fully Reimbursable Umbrella SAA between NASAand Integrated Mission Support Services, LLC for C3PW",2/2/2016,9/30/2020,Reimbursable,-----,KSC,KCA-4464-8
0,751,22322,"Integrated Mission Support Services, LLC","Annex 6 to Fully Reimbursable Umbrella SAA between NASAand Integrated Mission Support Services, LLC for C3PW",2/2/2016,9/30/2020,Reimbursable,-----,KSC,KCA-4464-6
1,752,22320,"Integrated Mission Support Services, LLC","Annex 5 to Fully Reimbursable Umbrella SAA between NASAand Integrated Mission Support Services, LLC for C3PW",2/2/2016,9/30/2020,Reimbursable,-----,KSC,KCA-4464-5
2,753,22319,"Integrated Mission Support Services, LLC","Annex 4 to Fully Reimbursable Umbrella SAA between NASAand Integrated Mission Support Services, LLC for C3PW",2/2/2016,9/30/2020,Reimbursable,-----,KSC,KCA-4464-4
3,754,22318,"Integrated Mission Support Services, LLC","Annex 3 to Fully Reimbursable Umbrella SAA between NASAand Integrated Mission Support Services, LLC for C3PW",2/2/2016,9/30/2020,Reimbursable,-----,KSC,KCA-4464-3
4,755,22315,"Integrated Mission Support Services, LLC","Annex 2 to Fully Reimbursable Umbrella SAA between NASAand Integrated Mission Support Services, LLC for C3PW",2/2/2016,9/30/2020,Reimbursable,-----,KSC,KCA-4464-2
0,757,21822,UNIVERSITY OF SOUTH FLORIDA,Nonreimbursable SAA Umbrella Agreement between NASAKSC and University of South Florida for Collaborative Research,9/9/2016,9/9/2021,Non-Reimbursable,$0,KSC,KCA-4486 Rev Basic
1,758,21351,FLORIDA INSTITUTE OF TECHNOLOGY,"Nonreimbursable SAA with Florida Institute of Technology (FIT)for Collaborative Research, Technology Transfer, Educationand Outreach Activities",6/29/2016,6/29/2021,Non-Reimbursable,$0,KSC,KCA-4471
2,759,20918,"CATERPILLAR, INC.",Non-Reimbursable Umbrella Space Act Agreement BetweenNASA KSC and Caterpillar INC. for Space TechnologyDevelopment and Testing,12/18/2015,12/18/2020,Non-Reimbursable,$0,KSC,KCA-4453
3,760,20782,Pacific International Space Center forExploration Systems,Non-Reimbursable Space Act Umbrella Agreement betweenNASA John F. Kennedy Space Center and Pacific InternationalSpace Center (PISCES) for Exploration Systems for SpaceTechnology Development and Testing,9/9/2015,9/9/2020,Non-Reimbursable,$0,KSC,KCA-4452
4,761,20723,Space Florida,Property Agreement between NASA KSC and Space Florida forThe Transfer of Operations and Management of the ShuttleLanding Facility,6/22/2015,6/22/2045,Reimbursable,-----,KSC,KCA-4412
0,763,16980,Light Visually Transceiving SystemCorporation,Reimbursable Umbrella SAA Between NASA KSC and LightVisually Ttransceiving System Corporation (LVX) for LightingSystem Communication and Network Augmentation Activities,7/30/2015,7/30/2020,Reimbursable,-----,KSC,KCA-4421
1,764,14880,Sierra Nevada Corporation,Space Act Agreement between NASA and Sierra NevadaCorporation for Commercial Crew Integrated Capability(CCiCap),8/2/2012,8/1/2022,Funded,"$227,500,000",KSC,NNK12MS03S
2,765,10940,"Space Florida, an independent special districtof the state of Florida","Real Property Use Permit between NASA KSC and SpaceFlorida for the Use of the Orbiter Processing Facility 3, TheSpace Shuttle Main Engine Processing Facility, and theProcessing Control Center",10/6/2011,6/1/2027,Reimbursable,-----,KSC,KCA-4311
3,766,10479,"UNITED LAUNCH ALLIANCE, LLC",SAA between United Launch Alliance and NASA LaunchServices Program for Access to and Operational Use of SpaceLaunch Complex 2 (SLC-2) and Delta II Launch VehicleGovernment Owned Equipment,8/23/2011,12/31/2027,Reimbursable,-----,KSC,KCA-4333
4,767,3798,Spaceport Florida Authority,"REAL PROPERTY USE PERMIT BETWEEN NASA ANDSPACEPORT FLORIDA AUTHORITY FOR DESIGN,CONSTRUCTION, AND OPERATION OF SERPL",4/5/2001,10/3/2033,Reimbursable,-----,KSC,KCA-1683-BASIC
0,769,32177,"BLUE ORIGIN, LLC",COLLABORATION ON SYSTEMS ENGINEERINGPROCESSES FOR VERIFICATION AND VALIDATION OFLAUNCH VEHICLE REQUIREMENTS,4/23/2020,2/28/2021,Non-Reimbursable,"$175,117",LaRC,SAA1-32177
1,770,32044,National Institute for Aviation Research-Wichita State University (niar),Composites NDE standards library and database administration,4/24/2020,4/24/2025,Non-Reimbursable,"$23,548",LaRC,SAA1-32044
2,771,31998,Lehigh University,Mentoring for University Technical Entrepreneurship Program,3/27/2020,3/27/2021,Non-Reimbursable,"$2,550",LaRC,SAA1-31998
3,772,31665,THE SPACESHIP COMPANY,Collaboration to Commercialize High Mach Aircraft,3/20/2020,3/20/2021,Non-Reimbursable,"$523,836",LaRC,"SAA1-31663, Annex 1"
4,773,31663,THE SPACESHIP COMPANY,Collaboration to Commercialize High Mach Aircraft,3/20/2020,3/20/2025,Non-Reimbursable,$0,LaRC,SAA1-31663
0,775,31475,The Boeing Company,Automated Fiber Placement Simulation Tool Development,4/9/2020,9/30/2020,Non-Reimbursable,"$109,445",LaRC,SAA1-31475
1,776,31409,ASX Composites,Co-Cure-Ply Materials Development,11/26/2019,11/26/2021,Non-Reimbursable,"$123,983",LaRC,SAA1-31409
2,777,31340,Lockheed Martin,Advanced Additive Manufacturing Technologies,12/10/2019,12/10/2021,Non-Reimbursable,"$11,917",LaRC,SAA1-31340
3,778,31335,Massachusetts Institute of TechnologyLincoln Laboratory,PoliMi 8x8 SPAD Array Module Proton Test,1/23/2020,1/23/2021,Non-Reimbursable,"$22,504",LaRC,SAA1-31335
4,779,31252,North Carolina State University,Wind Tunnel Testing of Pressure Sensitive Paint,11/12/2019,11/12/2021,Non-Reimbursable,"$92,816",LaRC,"SAA1-23398, Annex 5"
0,781,31140,"GENERAL ATOMICS AERONAUTICALSYSTEMS, INC.",Evaluation of Acoustic Liners for Fan Noise Reduction,10/9/2019,10/9/2024,Reimbursable,-----,LaRC,SAA1-31140
1,782,31071,"Genetoo, Inc.",Laser Surface Treatment and Analysis of Metal Alloys forAdhesion Mitigation,9/30/2019,12/31/2021,Non-Reimbursable,"$87,711",LaRC,SAA1-31071
2,783,31038,The Boeing Company,annex to AEROSPACE RESEARCH AND DEVELOPMENT,10/22/2019,10/22/2020,Reimbursable,-----,LaRC,"SAA1-21619,  Annex 6"
3,784,30998,Virginia Commonwealth University,VCU COLLEGE OF ENGINEERING CAPSTONE (SENIOR)DESIGN,10/16/2019,10/16/2020,Non-Reimbursable,"$16,461",LaRC,SAA1-30998
4,785,30948,Honda Aircraft Company LLC,Honda Aircraft Company Wind Tunnel Testing,9/5/2019,9/5/2022,Reimbursable,-----,LaRC,SAA1-30948
0,787,30776,University of Maryland,"Support of Fluid-Structure Interactions Testing, Part 2, in LaRC20-Inch Mach 6 Tunnel",12/5/2019,12/5/2020,Non-Reimbursable,"$164,703",LaRC,"SAA1-25454, Annex 3"
1,788,30742,"Jacobs Technology, Incorporated",AARGM-ER Wind Tunnel Test,9/4/2019,7/27/2020,Reimbursable,-----,LaRC,"SAA1-15634, Annex 6"
2,789,30731,RAYTHEON COMPANY,8HTT TESTING AND ASSESSMENT SUPPORT,8/1/2019,8/1/2020,Non-Reimbursable,"$3,432,123",LaRC,SAA1-30731
3,790,30707,"MOOG, INC",Autonomous Flight Control Development for Electric VTOLVehicles,1/18/2020,9/30/2020,Non-Reimbursable,"$124,163",LaRC,"SAA1-30706, Annex 1"
4,791,30706,"MOOG, INC",AEROSPACE RESEARCH TECHNOLOGY ANDDEVELOPMENT,1/18/2020,1/18/2025,Non-Reimbursable,$0,LaRC,SAA1-30706
0,793,30607,"BNNT, LLC",DEVELOPMENT AND OPTIMIZATION OF BORON NITRIDENANOTUBES,8/21/2019,8/21/2020,Non-Reimbursable,"$32,199",LaRC,"SAA1-30606, Annex 1"
1,794,30606,"BNNT, LLC",DEVELOPMENT AND OPTIMIZATION OF BORON NITRIDENANOTUBES,8/21/2019,8/21/2024,Non-Reimbursable,$0,LaRC,SAA1-30606
2,795,30581,The Boeing Company,Unique CFD Validation Data Using the High Lift CommonResearch Model (CRM-HL) from the Qinetiq 5M Wind Tunnel,8/12/2019,8/12/2021,Non-Reimbursable,"$184,193",LaRC,"SAA1-23831, Annex 12"
3,796,30465,The Boeing Company,Flight Evaluation of NASA Langley's Safeguard Technology,5/4/2020,5/4/2022,Non-Reimbursable,"$46,272",LaRC,"SAA1-23831, Annex 11"
4,797,30250,RAYTHEON COMPANY,TEST CONFIGURATION AND SUPPORT IN THE 8-FOOTHIGH TEMPERATURE TUNNEL,8/1/2019,8/1/2020,Reimbursable,-----,LaRC,SAA1-30250
0,799,30164,SIKORSKY AIRCRAFT CORP,Stroking Main Rotor Gearbox and Lower Fuselage Gun MountDrop Test,9/17/2019,9/17/2020,Reimbursable,-----,LaRC,SAA1-30164
1,800,30082,AURORA FLIGHT SCIENCES CORP,High-Efficiency Elecrified Aircraft Thermal Research,9/3/2019,1/3/2021,Non-Reimbursable,"$191,549",LaRC,SAA1-30082
2,801,29950,Oregon State University,Evaluation of Additively Manufactured Heat Sinks,4/2/2019,11/30/2020,Non-Reimbursable,"$10,359",LaRC,SAA1-29950
3,802,29851,"Exothermics, Inc.",Thermochemical Response of UHT Hypersonic Leading-EdgeCandidates,3/26/2019,9/30/2020,Reimbursable,-----,LaRC,SAA1-29851
4,803,29737,Florida State University,Validation of a Liner Drag Measurement/Computational Tool,3/19/2019,9/19/2020,Non-Reimbursable,"$14,020",LaRC,SAA1--29737
0,805,29424,Williamsburg-James City County PublicSchools,High School Students United With NASA to Create HardwareProgram,2/6/2019,2/6/2024,Non-Reimbursable,$0,LaRC,SAA1-29424
1,806,29215,Purdue University,Deployable Composite Sail Structure Materials ModelingResearch,2/22/2019,2/22/2021,Non-Reimbursable,"$15,826",LaRC,"SAA1-29213, Annex 2"
2,807,29214,Purdue University,Composite Deployable Sail Structure Development,2/21/2019,10/1/2020,Non-Reimbursable,"$25,038",LaRC,"SAA1-29213, Annex 1"
3,808,29213,Purdue University,Deployable Composite Solar Sail Structural Research,2/21/2019,2/21/2024,Non-Reimbursable,$0,LaRC,SAA1-29213
4,809,29171,Virginia Polytechnic Institute and StateUniversity,ThinSat Boom Technology Demonstration Project,12/13/2018,5/31/2021,Non-Reimbursable,"$32,727",LaRC,"SAA1-23392, Annex 5"
0,811,28997,Hexcel Corporation,Design and Evaluation of Novel Liner Configurations,11/5/2018,7/5/2020,Non-Reimbursable,"$13,218",LaRC,"SAA1-21586, Annex 2"
1,812,28891,The Boeing Company,Evaluation of Novel Aircraft Engine Liner Concepts,11/6/2018,11/6/2020,Reimbursable,-----,LaRC,"SAA1-21619, Annex 5"
2,813,28808,The Boeing Company,"The Development of a Science, Technology, Engineering andMathematics Capable Workforce",11/21/2018,11/21/2021,Non-Reimbursable,"$540,068",LaRC,SAA1-28808
3,814,28790,Wichita State University,Investigation of Metallic Foams for Acoustic Liner Applications,10/1/2018,4/1/2021,Non-Reimbursable,"$14,970",LaRC,"SAA1-28789, Annex 1"
4,815,28789,Wichita State University,Acoustic and Aero Liner Research,10/1/2018,10/1/2023,Non-Reimbursable,$0,LaRC,SAA1-28789
0,817,28502,North Carolina State University,Deployable Composite Booms and Deployment Systems,8/27/2018,8/30/2020,Non-Reimbursable,"$52,604",LaRC,"SAA1-23398, Annex 3"
1,818,28193,Virginia Polytechnic Institute and StateUniversity,Flight Evaluation of NASA Langleys Safeguard Technology,5/9/2019,5/9/2021,Non-Reimbursable,"$56,987",LaRC,"SAA1-23392, Annex 3"
2,819,28175,LOCKHEED MARTIN,Investigation of Advanced Processing of Metallic Materials,7/17/2018,12/30/2020,Reimbursable,-----,LaRC,"SAA1-28174, Annex 1"
3,820,28174,LOCKHEED MARTIN,Revolutionary Fabrication Methods and Materials Testing ofAdvanced Materials,7/17/2018,7/17/2023,Reimbursable,-----,LaRC,SAA1-28174
4,821,27976,VIRGINIA POLYTECHNIC INSTITUTE ANDSTATE UNIVERSITY,Collaborative Research and Development with the VirginiaPolytechnic Institute and State University TransportationInstitute,9/13/2019,9/13/2020,Non-Reimbursable,"$148,246",LaRC,"SAA1-23392, Annex 2"
0,823,27830,Boom Supersonic,FREE SPIN TEST IN THE 20-FOOT VERTICAL SPINTUNNEL,5/8/2018,8/9/2020,Reimbursable,-----,LaRC,"SAA1-27829, Annex 1"
1,824,27829,Boom Supersonic,Aerospace Research and Development,5/8/2018,5/8/2023,Reimbursable,-----,LaRC,SAA1-27829
2,825,27785,George Mason University,Interatomic Potential Development for Molecular DynamicsSimulations,5/31/2018,9/30/2020,Non-Reimbursable,"$278,363",LaRC,SAA1-27785
3,826,27688,Gulfstream AerospaceCorporation,Assessment of Tools for Sonic Boom Propagation andCertification,8/23/2018,8/23/2020,Non-Reimbursable,"$39,839",LaRC,"SAA1-24738, Annex 3"
4,827,27533,DoD Test Resources Management Center,HALAS Technology Demonstration,2/11/2019,12/31/2020,Reimbursable,-----,LaRC,"IA1-24848, Annex 4"
0,829,27243,JOHNS HOPKINS UNIVERSITY / APPLIEDPHYSICS LAB,Air Force Office of Scientific Research Boundary LayerTransition (BOLT) Experiments,3/14/2018,1/31/2021,Non-Reimbursable,"$626,489",LaRC,SAA1-27243
1,830,26937,National Institute of Aerospace,Laboratory and Facility Use for Boron Nitride Nanotube (BNNT)Research,12/7/2017,9/30/2020,Reimbursable,-----,LaRC,"SAA1-21594, Annex 7"
2,831,26910,Pennsylvania State University,Design and Additive Manufacturing of Ni-based Alloys,4/12/2018,4/12/2021,Non-Reimbursable,"$22,463",LaRC,SAA1-26910
3,832,26793,"Opto-Knowledge Systems, Inc.",annex to Optical Remote Sensing and Sensor Directed Flight ofNASA Related Activities,3/22/2019,8/31/2020,Reimbursable,-----,LaRC,"SAA1-20407, Annex 2"
4,833,26728,Hyperloop Transportation Technologies,"Research, Development, and Testing of AerospaceTechnologies",1/30/2018,1/30/2023,Reimbursable,-----,LaRC,26728
0,835,26521,The Boeing Company,Laser Ablation to Improve Adhesive Bonding of AerospaceStructural Thermoplastic Composite Materials,11/29/2017,12/22/2020,Non-Reimbursable,"$214,829",LaRC,"SAA1-21157, Annex 17"
1,836,26344,ALASKA AIRLINES,Research and Development Collaboration,9/25/2017,9/25/2022,Non-Reimbursable,$0,LaRC,SAA1-26344
2,837,26064,DoD Test Resources Management CenterDTMRC,HAARTS Technology Demonstration,9/29/2017,9/30/2020,Reimbursable,-----,LaRC,"IA1-24848, Annex 2"
3,838,25790,The Boeing Company,Traffic Aware Planner (TAP) Link to Boeing Climb OutPerformance (BCOP) data files,7/18/2017,11/18/2020,Non-Reimbursable,"$35,331",LaRC,"SAA1-23831, Annex 2"
4,839,25717,"PPG Industries, Inc.",Research Toward Aerospace Coatings for Mitigation ofEnvironmental Contaminants,9/21/2017,6/30/2021,Non-Reimbursable,"$43,068",LaRC,SAA1-25717
0,841,25454,University of Maryland,Hypersonic ShockWave Boundary Layer Fluid StructureIntereactions Technology Development,6/1/2017,6/1/2022,Non-Reimbursable,$0,LaRC,SAA1-25454
1,842,25384,NORFOLK STATE UNIVERSITY,ADVANCED CAPABILITIES FOR AERONAUTICSRESEARCH AND GROUND FACILITY TESTING,11/13/2017,11/13/2022,Non-Reimbursable,"$273,295",LaRC,SAA1-25384
2,843,25183,Purdue University,Support of Understanding of Experimental Mach 6 HypersonicBoundary Layers (BL),7/19/2017,7/19/2022,Non-Reimbursable,$0,LaRC,SAA1-25183
3,844,24848,Test Resources Management Center,Hypersonic Test and Technology Development,4/21/2017,4/21/2022,Reimbursable,-----,LaRC,IA1-24848
4,845,24799,Johns Hopkins University,Discovery to Market Project,1/24/2017,6/30/2021,Non-Reimbursable,"$11,697",LaRC,SAA1-24799
0,847,24391,Isle of Wight County Public School,High School Students United with NASA to Create Hardware(HUNCH) Program,12/2/2016,12/2/2021,Non-Reimbursable,$0,LaRC,SAA1-24391
1,848,24387,York County School District,High School Students United with NASA to Create Hardware(HUNCH) Program,11/29/2016,11/29/2021,Non-Reimbursable,$0,LaRC,SAA1-24387
2,849,24364,North Carolina School of Science & Math,High School Students United with NASA to Create Hardware(HUNCH) Program,11/15/2016,11/15/2021,Non-Reimbursable,$0,LaRC,SAA1-24364
3,850,24362,Gloucester County Public School District,High School Students United with NASA to Create Hardware(HUNCH) Program,12/6/2016,12/6/2021,Non-Reimbursable,$0,LaRC,SAA1-24362
4,851,24257,Hampton City Schools,High School Students United with NASA to Create Hardware(HUNCH) Program,10/21/2016,10/21/2021,Non-Reimbursable,$0,LaRC,SAA1-24257
0,853,24186,Fayetteville State University,"COLLABORATIVE AEROSPACE RESEARCH,DEVELOPMENT, AND TESTING OPPORTUNITIES",12/15/2016,12/15/2021,Non-Reimbursable,$0,LaRC,SAA1-24186
1,854,24122,University of Washington,Technical Interchange on Applications of Data Analytics andMachine Learning in Aerospace Domains,12/5/2016,12/5/2021,Non-Reimbursable,$0,LaRC,SAA1-24122
2,855,24034,The Boeing Company,Flight Deck Systems and Operations Research,1/20/2017,1/20/2022,Non-Reimbursable,"$816,127",LaRC,SAA1-24034
3,856,24017,"Textron Aviation, Inc.",Laboratory and Flight Aeronautical Research,4/5/2017,4/5/2022,Non-Reimbursable,$0,LaRC,SAA1-24017
4,857,23957,Newport News Public School District,High School Students United with NASA to Create Hardware(HUNCH) Program,10/23/2016,10/23/2021,Non-Reimbursable,$0,LaRC,SAA1-23957
0,859,23883,The Boeing Company,Annex 5 to ENVIRONMENTALLY  RESPONSIBLE AIRVEHICLE CONCEPT RESEARCH,11/15/2016,11/15/2020,Non-Reimbursable,"$10,442",LaRC,"SAA1-21157, Annex 5"
1,860,23831,The Boeing Company,Aerospace Research Development,2/3/2017,2/3/2022,Non-Reimbursable,$0,LaRC,SAA1-23831
2,861,23827,Tech Center LLC,Cooperative Research Activities in Manufacturing Technologies,7/5/2017,7/5/2022,Non-Reimbursable,$0,LaRC,SAA1-23827
3,862,23647,"Psionic, LLC",Space Technology Commercialization for Measurement andMaterials Applications,12/16/2016,12/16/2021,Reimbursable,-----,LaRC,SAA1-23647
4,863,23579,GenEdge Alliance,Cooperative Research Activities in Manufacturing Technologies,2/23/2017,2/23/2022,Non-Reimbursable,$0,LaRC,SAA1-23579
0,865,23398,North Carolina State University,"COLLABORATIVE AEROSPACE R ESEARCH,DEVELOPMENT, AND TESTING OPPORTUNITIES",6/20/2017,6/20/2022,Non-Reimbursable,$0,LaRC,SAA1-23398
1,866,23392,Virginia Polytechnic Institute and StateUniversity,"Collaborative Research, Development, and TestingOportunities",11/16/2016,11/16/2021,Non-Reimbursable,$0,LaRC,SAA1-23392
2,867,23274,The Governor`s School for Science &Technology,STEM Education Collaboration,6/23/2016,6/30/2020,Non-Reimbursable,"$50,075",LaRC,SAA1-23274
3,868,23227,"Materials Research and Design, Inc. MR&D",HIGH TEMPERATURE MATERIALS TECHNICAL SUPPORT,1/4/2017,9/30/2020,Reimbursable,-----,LaRC,SAA1-23227
4,869,23219,TEXAS A&M ENGINEERING EXPERIMENTSTATION,PARTICIPATION IN COOPERATIVE RESEARCH ANDDEVELOPMENT PROJECTS,11/4/2016,11/4/2021,Non-Reimbursable,"$70,317",LaRC,SAA1-23219
0,871,22747,Dominion Virginia Power,UAV Autonomous Inspection of Transmission Lines,6/9/2016,6/9/2021,Non-Reimbursable,$0,LaRC,SAA1-22747
1,872,22746,Raytheon Corporation,Optical Remote Sensing for Space Applications in Robotics andSurveillance,12/21/2016,12/21/2021,Reimbursable,-----,LaRC,SAA1-22746
2,873,22628,Southern Company,UAV Autonomous Inspection of Transmission Lines,6/3/2016,6/3/2021,Reimbursable,-----,LaRC,SAA1-22628
3,874,22625,idoodledu,Support Of The Cubes In Space Initiative,7/22/2016,7/22/2021,Non-Reimbursable,"$30,014",LaRC,SAA1-22625
4,875,22217,Infrasonix-Inc,Infrasonix Stethoscope Evaluation Over Human Subjects,11/28/2017,11/28/2022,Reimbursable,-----,LaRC,SAA1-22217
0,877,21962,"Brookhaven Science Associates, LLC",User Agreement for Brookhaven National Laboratory,12/30/2015,12/30/2020,Non-Reimbursable,$0,LaRC,SAA1-21962
1,878,21824,North Carolina Agricultural and TechnicalUniversity,"Collaborative Research, Development, and TestingOpportunities",4/21/2016,4/21/2021,Non-Reimbursable,$0,LaRC,SAA1-21824
2,879,21741,Oklahoma State University,"COLLABORATIVE AEROSPACE RESEARCH,DEVELOPMENT, AND TESTING OPPORTUNITIES",2/4/2016,2/4/2021,Non-Reimbursable,$0,LaRC,SAA1-21741
3,880,21619,The Boeing Company,AEROSPACE RESEARCH AND DEVELOPMENT,11/20/2015,11/20/2020,Reimbursable,-----,LaRC,SAA1-21619
4,881,21608,University of Michigan,Umbrella Agreement,4/18/2016,4/18/2021,Non-Reimbursable,$0,LaRC,SAA1-21608
0,883,21594,National Institute of Aerospace,"RESEARCH, EDUCATIONAL OUTREACH, AND TESTINGACTIVITIES",11/17/2015,11/17/2020,Reimbursable,-----,LaRC,SAA1-21594
1,884,21586,Hexcel Corporation,Multiple Degree of Freedom Acoustic Liners,1/5/2016,1/5/2021,Non-Reimbursable,$0,LaRC,SAA1-21586
2,885,21560,Carnegie Mellon University,Carnegie Mellon University with NASA Langley ResearchCenter,2/2/2016,2/2/2021,Non-Reimbursable,$0,LaRC,SAA1-21560
3,886,21157,The Boeing Company,ENVIRONMENTALLY  RESPONSIBLE AIR VEHICLECONCEPT RESEARCH,12/22/2015,12/22/2020,Non-Reimbursable,$0,LaRC,SAA1-21157
4,887,20805,Johns Hopkins University,Collaboration to Identify Technical Areas of Mutual Interest,12/16/2015,12/16/2020,Non-Reimbursable,$0,LaRC,SAA1-20805
0,889,20618,Arx Pax,Research and Development of Magnetic Architectures andOther Technologies,7/30/2015,7/30/2020,Non-Reimbursable,$0,LaRC,SAA1-20618
1,890,20407,"Opto-Knowledge Systems, Inc.",Optical Remote Sensing and Sensor Directed Flight of NASARelated Activities,5/27/2015,9/30/2020,Reimbursable,-----,LaRC,SAA1-20407
2,891,19659,Old Dominion University,"COLLABORATIVE RESEARCH, DEVELOPMENT, ANDTESTING",8/5/2015,8/5/2020,Non-Reimbursable,$0,LaRC,SAA1-19659
3,892,18617,United Technologies Corporation,Aerospace Research and Development,8/6/2015,8/6/2020,Reimbursable,-----,LaRC,SAA1-18617
4,893,15634,"Jacobs Technology, Incorporated",Marketing of Langley Research Center Wind Tunnel TestingCapability,7/27/2015,7/27/2020,Reimbursable,-----,LaRC,SAA1-15634
0,895,32638,Lockheed Martin Space,Exchange of Technical Expertise for commercial spacetransportation,6/24/2020,6/24/2025,Reimbursable,-----,MSFC,SAA8-2032638
1,896,32156,"Imperx, Inc.",Rugged Space Rated High Definition  Serial Data Interface(HD-SDI) Camera,5/11/2020,5/11/2022,Non-Reimbursable,"$239,458",MSFC,SAA8-2032156
2,897,32095,"Blue Origin Florida, LLC",Production Implementation,6/11/2020,6/11/2022,Reimbursable,-----,MSFC,SAA8-2032094.1
3,898,32094,"Blue Origin Florida, LLC",Production Implementation,6/11/2020,6/11/2025,Reimbursable,-----,MSFC,SAA8-2032094
4,899,32084,ATK Launch Systems,ATK Hot Gas Testing,6/4/2020,6/4/2021,Reimbursable,-----,MSFC,SAA8-1931535.2
0,901,32023,Vivace Corporation,Amendment 2 to Vivace SAA8-1725627 to extend the Term ofAgreement and update the Financial Obligations,6/9/2017,6/30/2021,Reimbursable,-----,MSFC,SAA8-1725627.A2
1,902,31862,"ASTROBOTIC TECHNOLOGY, INC",Provide NASA expertise in lunar cargo transportation andlanding technologies,6/4/2020,6/4/2021,Reimbursable,-----,MSFC,SAA8-1930516.2
2,903,31832,U.S. Space & Rocket Center,2020 NASA Human Exploration Rover Challenge,3/8/2020,4/8/2021,Reimbursable,-----,MSFC,SAA8-2031832
3,904,31754,"BLUE ORIGIN, LLC",Blue Origin Hot Gas Testing of Materials @ Hot Gas TestFacility,5/8/2020,5/8/2021,Reimbursable,-----,MSFC,SAA8-1725986.21
4,905,31674,KT Engineering Corporation,CFD  Analysis of the Aerospike Flight Test Article (AFTA) inSupport of USAF ARISE Program,2/5/2020,2/5/2021,Reimbursable,-----,MSFC,SAA8-2031673.1
0,907,31656,Oceangate,Oceangate Automated Fiber Placement Development,2/4/2020,2/4/2021,Reimbursable,-----,MSFC,SAA8-2031655.1
